cui1,cui2,relation,name1,name2,type1,type2,weight,predicate
C0003451,C1512886,INHIBITS,Antiviral Agents,Internal Ribosome Entry Sites,phsu,nusq,1,INHIBITS_PHSUinhbNUSQ
C1520007,C0004793,INHIBITS,Viral Vector,Base Sequence,phsu,nusq,1,INHIBITS_PHSUinhbNUSQ
C1874451,C0242611,INHIBITS,Basis,"Codon, Terminator",phsu,nusq,1,INHIBITS_PHSUinhbNUSQ
C3539125,C0242611,INHIBITS,other medicated shampoos in ATC,"Codon, Terminator",phsu,nusq,1,INHIBITS_PHSUinhbNUSQ
C3539957,C0162326,INHIBITS,opium alkaloids and derivative combination cough suppressants,DNA Sequence,phsu,nusq,1,INHIBITS_PHSUinhbNUSQ
